{
  "formatVersion": 1,
  "id": "navigation",
  "name": "Barre de navigation",
  "template": true,
  "state": {
    "tab": { "type": "enum", "values": ["home"], "default": "home" }
  },
  "layers": [
    { "id": "navbar", "texture": "common/navbar.png", "x": 0, "y": 15, "generator": { "kind": "tabs", "count": 8 } },
    { "id": "background", "texture": "common/default_background.png", "x": 0, "y": 33 }
  ],
  "slots": [
    {
      "id": "back", "kind": "button", "area": { "col": 0, "row": 0 },
      "item": { "invisible": true, "name": "<gray>Retour" },
      "onClick": [{ "type": "back" }]
    }
  ]
}
